{
  "schema_version": "1.0.0",
  "repo": {
    "id": "github-recent__process-co__ui",
    "name": "process-co__ui",
    "path": "/Users/bwm.barbinewarnermichael/Documents/github/repositories/github-recent/process-co__ui",
    "remote_url": "git@github.com:process-co/ui.git",
    "description": "[<img src=\"https://img.shields.io/npm/v/%40process.co%2Fui\" />](https://www.npmjs.com/package/@process.co/ui)",
    "primary_language": "CSS",
    "languages": [
      "CSS",
      "Markdown",
      "YAML",
      "JSON",
      "TypeScript"
    ],
    "frameworks": [],
    "package_manager": "npm",
    "databases": [],
    "deployment": [
      "github-actions"
    ],
    "maturity": "internal",
    "confidence": "high",
    "scan_artifact": "catalog/scans/github-recent__process-co__ui.scan.json",
    "analyzed_at": "2026-05-16T16:44:32.550Z"
  },
  "capabilities": [
    {
      "id": "data.import-export",
      "name": "Data Import and Export",
      "type": "data-export",
      "summary": "Source evidence indicates import, export, CSV, JSON, XML, or structured data transfer behavior.",
      "maturity": "internal",
      "reusable": true,
      "confidence": "low",
      "source_paths": [
        "package.json"
      ],
      "interfaces": {
        "api_routes": [],
        "ui_components": [],
        "cli_commands": [],
        "events": [],
        "exports": [],
        "inputs": [
          "structured data input"
        ],
        "outputs": [
          "structured data output"
        ]
      },
      "data_handling": {
        "reads": [
          "structured data input"
        ],
        "writes": [
          "structured data output"
        ],
        "sensitive_data": [],
        "external_data_flows": [],
        "persistence_layer": [],
        "validation": [],
        "auth_requirements": [],
        "privacy_security_notes": []
      },
      "dependencies": {
        "packages": [],
        "internal": [],
        "external_services": [],
        "env_vars": []
      },
      "reuse": {
        "reusable": "partial",
        "extraction_difficulty": "unknown",
        "coupling": {
          "framework": "unknown",
          "database": "low",
          "external_services": "low",
          "auth": "low"
        },
        "recommended_reuse_approach": "Extract the source-backed files with their dependencies, then add tests around the target integration boundary.",
        "extraction_steps": [
          "Review all listed source paths.",
          "Copy only source-backed implementation files and required local dependencies.",
          "Replace repository-specific configuration, routes, and environment variable handling.",
          "Add tests that prove the capability in the target project."
        ],
        "notes": [
          "Pattern capability generated from deterministic file, route, dependency, or environment-name evidence."
        ]
      },
      "risks": [],
      "tests": {
        "has_tests": false,
        "test_paths": [],
        "notes": [
          "No repository test files were detected for this capability."
        ]
      },
      "docs": {
        "readme": true,
        "docs_paths": [
          ".github/README.md",
          "README.md"
        ],
        "llms_context_paths": [],
        "notes": []
      },
      "related_capabilities": [],
      "notes": [
        "Pattern capability generated from deterministic file, route, dependency, or environment-name evidence."
      ]
    },
    {
      "id": "deployment.project-automation",
      "name": "Deployment and Project Automation",
      "type": "deployment",
      "summary": "Repository includes CI workflows, deployment config, or containerization files.",
      "maturity": "internal",
      "reusable": true,
      "confidence": "high",
      "source_paths": [
        ".github/workflows/publish-ui.yml"
      ],
      "interfaces": {
        "api_routes": [],
        "ui_components": [],
        "cli_commands": [],
        "events": [],
        "exports": [],
        "inputs": [
          "CI configuration",
          "repository source"
        ],
        "outputs": [
          "build artifacts or deployment outputs"
        ]
      },
      "data_handling": {
        "reads": [
          "CI configuration",
          "repository source"
        ],
        "writes": [
          "build artifacts or deployment outputs"
        ],
        "sensitive_data": [],
        "external_data_flows": [],
        "persistence_layer": [],
        "validation": [],
        "auth_requirements": [],
        "privacy_security_notes": []
      },
      "dependencies": {
        "packages": [],
        "internal": [],
        "external_services": [],
        "env_vars": []
      },
      "reuse": {
        "reusable": "pattern_only",
        "extraction_difficulty": "medium",
        "coupling": {
          "framework": "unknown",
          "database": "low",
          "external_services": "low",
          "auth": "low"
        },
        "recommended_reuse_approach": "Reuse the implementation pattern after recreating it in the target project's framework and test harness.",
        "extraction_steps": [
          "Review all listed source paths.",
          "Copy only source-backed implementation files and required local dependencies.",
          "Replace repository-specific configuration, routes, and environment variable handling.",
          "Add tests that prove the capability in the target project."
        ],
        "notes": []
      },
      "risks": [],
      "tests": {
        "has_tests": false,
        "test_paths": [],
        "notes": [
          "No repository test files were detected for this capability."
        ]
      },
      "docs": {
        "readme": true,
        "docs_paths": [
          ".github/README.md",
          "README.md"
        ],
        "llms_context_paths": [],
        "notes": []
      },
      "related_capabilities": [],
      "notes": []
    }
  ],
  "repository_risks": [
    {
      "id": "quality.missing-tests",
      "severity": "medium",
      "summary": "No automated test files were detected.",
      "evidence_paths": [
        ".github/README.md",
        "package.json",
        "README.md"
      ],
      "recommendation": "Add focused tests before treating capabilities as production-ready reuse candidates."
    }
  ],
  "catalog_quality": {
    "coverage": {
      "scan_artifact": true,
      "readme": true,
      "docs": true,
      "routes": false,
      "tests": false,
      "llms_context": false
    },
    "missing_evidence": [
      "test files not detected",
      "LLMs context files not detected",
      "framework route files not detected"
    ],
    "uncertainty_notes": [
      "Generated by evidence-bound bootstrap analyzer. Run with CATALOG_USE_CODEX=1 for schema-constrained Codex interpretation."
    ],
    "validation_status": "valid",
    "validated_at": "2026-05-16T16:44:32.568Z"
  }
}
