{
  "schema_version": "1.0.0",
  "repo": {
    "id": "github-recent__process-partners__.github",
    "name": "process-partners__.github",
    "path": "/Users/bwm.barbinewarnermichael/Documents/github/repositories/github-recent/process-partners__.github",
    "remote_url": "git@github.com:process-partners/.github.git",
    "description": "<p align=\"center\">",
    "primary_language": "Markdown",
    "languages": [
      "Markdown"
    ],
    "frameworks": [],
    "package_manager": null,
    "databases": [],
    "deployment": [],
    "maturity": "prototype",
    "confidence": "medium",
    "scan_artifact": "catalog/scans/github-recent__process-partners__.github.scan.json",
    "analyzed_at": "2026-05-16T16:44:32.607Z"
  },
  "capabilities": [
    {
      "id": "other.repository-context",
      "name": "Repository Context",
      "type": "other",
      "summary": "Repository has limited deterministic evidence; purpose requires further Codex or human review.",
      "maturity": "prototype",
      "reusable": false,
      "confidence": "low",
      "source_paths": [
        "profile/README.md"
      ],
      "interfaces": {
        "api_routes": [],
        "ui_components": [],
        "cli_commands": [],
        "events": [],
        "exports": [],
        "inputs": [
          "repository metadata"
        ],
        "outputs": []
      },
      "data_handling": {
        "reads": [
          "repository metadata"
        ],
        "writes": [],
        "sensitive_data": [],
        "external_data_flows": [],
        "persistence_layer": [],
        "validation": [],
        "auth_requirements": [],
        "privacy_security_notes": []
      },
      "dependencies": {
        "packages": [],
        "internal": [],
        "external_services": [],
        "env_vars": []
      },
      "reuse": {
        "reusable": "unknown",
        "extraction_difficulty": "unknown",
        "coupling": {
          "framework": "unknown",
          "database": "low",
          "external_services": "low",
          "auth": "low"
        },
        "recommended_reuse_approach": "Use only as a review target until source behavior is inspected.",
        "extraction_steps": [
          "Review all listed source paths.",
          "Copy only source-backed implementation files and required local dependencies.",
          "Replace repository-specific configuration, routes, and environment variable handling.",
          "Add tests that prove the capability in the target project."
        ],
        "notes": []
      },
      "risks": [],
      "tests": {
        "has_tests": false,
        "test_paths": [],
        "notes": [
          "No repository test files were detected for this capability."
        ]
      },
      "docs": {
        "readme": true,
        "docs_paths": [
          "profile/README.md"
        ],
        "llms_context_paths": [],
        "notes": []
      },
      "related_capabilities": [],
      "notes": []
    }
  ],
  "repository_risks": [
    {
      "id": "quality.missing-tests",
      "severity": "medium",
      "summary": "No automated test files were detected.",
      "evidence_paths": [
        "profile/README.md"
      ],
      "recommendation": "Add focused tests before treating capabilities as production-ready reuse candidates."
    }
  ],
  "catalog_quality": {
    "coverage": {
      "scan_artifact": true,
      "readme": true,
      "docs": true,
      "routes": false,
      "tests": false,
      "llms_context": false
    },
    "missing_evidence": [
      "test files not detected",
      "CI workflows not detected",
      "LLMs context files not detected",
      "framework route files not detected"
    ],
    "uncertainty_notes": [
      "Generated by evidence-bound bootstrap analyzer. Run with CATALOG_USE_CODEX=1 for schema-constrained Codex interpretation."
    ],
    "validation_status": "valid",
    "validated_at": "2026-05-16T16:44:32.626Z"
  }
}
