{
  "schema_version": "1.0.0",
  "repo": {
    "id": "github-recent__mbarbine__jenkinsdb",
    "name": "mbarbine__JenkinsDB",
    "path": "/Users/bwm.barbinewarnermichael/Documents/github/repositories/github-recent/mbarbine__JenkinsDB",
    "remote_url": "git@github.com:mbarbine/JenkinsDB.git",
    "description": "SUMMARY:",
    "primary_language": "SQL",
    "languages": [
      "SQL",
      "XML"
    ],
    "frameworks": [],
    "package_manager": null,
    "databases": [],
    "deployment": [],
    "maturity": "prototype",
    "confidence": "medium",
    "scan_artifact": "catalog/scans/github-recent__mbarbine__jenkinsdb.scan.json",
    "analyzed_at": "2026-05-16T16:44:09.682Z"
  },
  "capabilities": [
    {
      "id": "automation.workflow-runner",
      "name": "Workflow Runner",
      "type": "automation",
      "summary": "Source evidence indicates jobs, workflows, queues, cron tasks, or automation runs.",
      "maturity": "prototype",
      "reusable": true,
      "confidence": "low",
      "source_paths": [
        "Powershell Scripts, Files, and Tasks/Directory Structure/DATA (E DRIVE)/E-Colon-Slash XML/builds/README.txt",
        "Powershell Scripts, Files, and Tasks/Directory Structure/DATA (E DRIVE)/README.txt",
        "Powershell Scripts, Files, and Tasks/Scheduled Tasks/README.txt",
        "SQL/Jenkins/SQL Agent Jobs/README.txt"
      ],
      "interfaces": {
        "api_routes": [],
        "ui_components": [],
        "cli_commands": [],
        "events": [],
        "exports": [],
        "inputs": [
          "workflow inputs or queued jobs"
        ],
        "outputs": [
          "workflow run state or task outputs"
        ]
      },
      "data_handling": {
        "reads": [
          "workflow inputs or queued jobs"
        ],
        "writes": [
          "workflow run state or task outputs"
        ],
        "sensitive_data": [],
        "external_data_flows": [],
        "persistence_layer": [],
        "validation": [],
        "auth_requirements": [],
        "privacy_security_notes": []
      },
      "dependencies": {
        "packages": [],
        "internal": [],
        "external_services": [],
        "env_vars": []
      },
      "reuse": {
        "reusable": "partial",
        "extraction_difficulty": "unknown",
        "coupling": {
          "framework": "unknown",
          "database": "low",
          "external_services": "low",
          "auth": "low"
        },
        "recommended_reuse_approach": "Extract the source-backed files with their dependencies, then add tests around the target integration boundary.",
        "extraction_steps": [
          "Review all listed source paths.",
          "Copy only source-backed implementation files and required local dependencies.",
          "Replace repository-specific configuration, routes, and environment variable handling.",
          "Add tests that prove the capability in the target project."
        ],
        "notes": [
          "Pattern capability generated from deterministic file, route, dependency, or environment-name evidence."
        ]
      },
      "risks": [],
      "tests": {
        "has_tests": false,
        "test_paths": [],
        "notes": [
          "No repository test files were detected for this capability."
        ]
      },
      "docs": {
        "readme": true,
        "docs_paths": [
          "Powershell Scripts, Files, and Tasks/Directory Structure/DATA (E DRIVE)/E-Colon-Slash XML/builds/README.txt",
          "Powershell Scripts, Files, and Tasks/Directory Structure/DATA (E DRIVE)/README.txt",
          "Powershell Scripts, Files, and Tasks/Scheduled Tasks/README.txt",
          "README.txt",
          "SQL/Jenkins/README.txt",
          "SQL/Jenkins/SQL Agent Jobs/README.txt",
          "SQL/Jenkins/StoredProcedures/README.txt",
          "SQL/Jenkins/Tables/README.txt",
          "SQL/Jenkins/Views/README.txt"
        ],
        "llms_context_paths": [],
        "notes": []
      },
      "related_capabilities": [],
      "notes": [
        "Pattern capability generated from deterministic file, route, dependency, or environment-name evidence."
      ]
    },
    {
      "id": "data.import-export",
      "name": "Data Import and Export",
      "type": "data-export",
      "summary": "Source evidence indicates import, export, CSV, JSON, XML, or structured data transfer behavior.",
      "maturity": "prototype",
      "reusable": true,
      "confidence": "low",
      "source_paths": [
        "Powershell Scripts, Files, and Tasks/Directory Structure/DATA (E DRIVE)/E-Colon-Slash XML/builds/README.txt"
      ],
      "interfaces": {
        "api_routes": [],
        "ui_components": [],
        "cli_commands": [],
        "events": [],
        "exports": [],
        "inputs": [
          "structured data input"
        ],
        "outputs": [
          "structured data output"
        ]
      },
      "data_handling": {
        "reads": [
          "structured data input"
        ],
        "writes": [
          "structured data output"
        ],
        "sensitive_data": [],
        "external_data_flows": [],
        "persistence_layer": [],
        "validation": [],
        "auth_requirements": [],
        "privacy_security_notes": []
      },
      "dependencies": {
        "packages": [],
        "internal": [],
        "external_services": [],
        "env_vars": []
      },
      "reuse": {
        "reusable": "partial",
        "extraction_difficulty": "unknown",
        "coupling": {
          "framework": "unknown",
          "database": "low",
          "external_services": "low",
          "auth": "low"
        },
        "recommended_reuse_approach": "Extract the source-backed files with their dependencies, then add tests around the target integration boundary.",
        "extraction_steps": [
          "Review all listed source paths.",
          "Copy only source-backed implementation files and required local dependencies.",
          "Replace repository-specific configuration, routes, and environment variable handling.",
          "Add tests that prove the capability in the target project."
        ],
        "notes": [
          "Pattern capability generated from deterministic file, route, dependency, or environment-name evidence."
        ]
      },
      "risks": [],
      "tests": {
        "has_tests": false,
        "test_paths": [],
        "notes": [
          "No repository test files were detected for this capability."
        ]
      },
      "docs": {
        "readme": true,
        "docs_paths": [
          "Powershell Scripts, Files, and Tasks/Directory Structure/DATA (E DRIVE)/E-Colon-Slash XML/builds/README.txt",
          "Powershell Scripts, Files, and Tasks/Directory Structure/DATA (E DRIVE)/README.txt",
          "Powershell Scripts, Files, and Tasks/Scheduled Tasks/README.txt",
          "README.txt",
          "SQL/Jenkins/README.txt",
          "SQL/Jenkins/SQL Agent Jobs/README.txt",
          "SQL/Jenkins/StoredProcedures/README.txt",
          "SQL/Jenkins/Tables/README.txt",
          "SQL/Jenkins/Views/README.txt"
        ],
        "llms_context_paths": [],
        "notes": []
      },
      "related_capabilities": [],
      "notes": [
        "Pattern capability generated from deterministic file, route, dependency, or environment-name evidence."
      ]
    }
  ],
  "repository_risks": [
    {
      "id": "quality.missing-tests",
      "severity": "medium",
      "summary": "No automated test files were detected.",
      "evidence_paths": [
        "Powershell Scripts, Files, and Tasks/Directory Structure/DATA (E DRIVE)/E-Colon-Slash XML/builds/README.txt",
        "Powershell Scripts, Files, and Tasks/Directory Structure/DATA (E DRIVE)/README.txt",
        "Powershell Scripts, Files, and Tasks/Scheduled Tasks/README.txt",
        "README.txt",
        "SQL/Jenkins/README.txt",
        "SQL/Jenkins/SQL Agent Jobs/README.txt",
        "SQL/Jenkins/StoredProcedures/README.txt",
        "SQL/Jenkins/Tables/README.txt",
        "SQL/Jenkins/Views/README.txt"
      ],
      "recommendation": "Add focused tests before treating capabilities as production-ready reuse candidates."
    }
  ],
  "catalog_quality": {
    "coverage": {
      "scan_artifact": true,
      "readme": true,
      "docs": true,
      "routes": false,
      "tests": false,
      "llms_context": false
    },
    "missing_evidence": [
      "test files not detected",
      "CI workflows not detected",
      "LLMs context files not detected",
      "framework route files not detected"
    ],
    "uncertainty_notes": [
      "Generated by evidence-bound bootstrap analyzer. Run with CATALOG_USE_CODEX=1 for schema-constrained Codex interpretation."
    ],
    "validation_status": "valid",
    "validated_at": "2026-05-16T16:44:09.702Z"
  }
}
