{
  "schema_version": "1.0.0",
  "repo": {
    "id": "github-recent__mbarbine__uberpidgeons-www",
    "name": "mbarbine__uberpidgeons-www",
    "path": "/Users/bwm.barbinewarnermichael/Documents/github/repositories/github-recent/mbarbine__uberpidgeons-www",
    "remote_url": "git@github.com:mbarbine/uberpidgeons-www.git",
    "description": "This is a [Next.js](https://nextjs.org) project bootstrapped with [`create-next-app`](https://nextjs.org/docs/app/api-reference/cli/create-next-app).",
    "primary_language": "JSON",
    "languages": [
      "JSON",
      "TypeScript",
      "Markdown",
      "CSS",
      "JavaScript"
    ],
    "frameworks": [
      "Next.js",
      "React",
      "Tailwind CSS"
    ],
    "package_manager": "npm",
    "databases": [],
    "deployment": [],
    "maturity": "internal",
    "confidence": "high",
    "scan_artifact": "catalog/scans/github-recent__mbarbine__uberpidgeons-www.scan.json",
    "analyzed_at": "2026-05-16T16:44:27.367Z"
  },
  "capabilities": [
    {
      "id": "content.publishing-workflow",
      "name": "Content Publishing Workflow",
      "type": "content-management",
      "summary": "Source evidence indicates content, docs, posts, publishing, CMS, or markdown/MDX workflows.",
      "maturity": "internal",
      "reusable": true,
      "confidence": "low",
      "source_paths": [
        "package.json",
        "postcss.config.mjs"
      ],
      "interfaces": {
        "api_routes": [],
        "ui_components": [],
        "cli_commands": [],
        "events": [],
        "exports": [],
        "inputs": [
          "content source files or editorial metadata"
        ],
        "outputs": [
          "published content pages or feeds"
        ]
      },
      "data_handling": {
        "reads": [
          "content source files or editorial metadata"
        ],
        "writes": [
          "published content pages or feeds"
        ],
        "sensitive_data": [],
        "external_data_flows": [],
        "persistence_layer": [],
        "validation": [],
        "auth_requirements": [],
        "privacy_security_notes": []
      },
      "dependencies": {
        "packages": [],
        "internal": [],
        "external_services": [],
        "env_vars": []
      },
      "reuse": {
        "reusable": "partial",
        "extraction_difficulty": "unknown",
        "coupling": {
          "framework": "medium",
          "database": "low",
          "external_services": "low",
          "auth": "low"
        },
        "recommended_reuse_approach": "Extract the source-backed files with their dependencies, then add tests around the target integration boundary.",
        "extraction_steps": [
          "Review all listed source paths.",
          "Copy only source-backed implementation files and required local dependencies.",
          "Replace repository-specific configuration, routes, and environment variable handling.",
          "Add tests that prove the capability in the target project."
        ],
        "notes": [
          "Pattern capability generated from deterministic file, route, dependency, or environment-name evidence."
        ]
      },
      "risks": [],
      "tests": {
        "has_tests": false,
        "test_paths": [],
        "notes": [
          "No repository test files were detected for this capability."
        ]
      },
      "docs": {
        "readme": true,
        "docs_paths": [
          "README.md"
        ],
        "llms_context_paths": [],
        "notes": []
      },
      "related_capabilities": [],
      "notes": [
        "Pattern capability generated from deterministic file, route, dependency, or environment-name evidence."
      ]
    },
    {
      "id": "data.import-export",
      "name": "Data Import and Export",
      "type": "data-export",
      "summary": "Source evidence indicates import, export, CSV, JSON, XML, or structured data transfer behavior.",
      "maturity": "internal",
      "reusable": true,
      "confidence": "low",
      "source_paths": [
        "package.json",
        "tsconfig.json"
      ],
      "interfaces": {
        "api_routes": [],
        "ui_components": [],
        "cli_commands": [],
        "events": [],
        "exports": [],
        "inputs": [
          "structured data input"
        ],
        "outputs": [
          "structured data output"
        ]
      },
      "data_handling": {
        "reads": [
          "structured data input"
        ],
        "writes": [
          "structured data output"
        ],
        "sensitive_data": [],
        "external_data_flows": [],
        "persistence_layer": [],
        "validation": [],
        "auth_requirements": [],
        "privacy_security_notes": []
      },
      "dependencies": {
        "packages": [],
        "internal": [],
        "external_services": [],
        "env_vars": []
      },
      "reuse": {
        "reusable": "partial",
        "extraction_difficulty": "unknown",
        "coupling": {
          "framework": "medium",
          "database": "low",
          "external_services": "low",
          "auth": "low"
        },
        "recommended_reuse_approach": "Extract the source-backed files with their dependencies, then add tests around the target integration boundary.",
        "extraction_steps": [
          "Review all listed source paths.",
          "Copy only source-backed implementation files and required local dependencies.",
          "Replace repository-specific configuration, routes, and environment variable handling.",
          "Add tests that prove the capability in the target project."
        ],
        "notes": [
          "Pattern capability generated from deterministic file, route, dependency, or environment-name evidence."
        ]
      },
      "risks": [],
      "tests": {
        "has_tests": false,
        "test_paths": [],
        "notes": [
          "No repository test files were detected for this capability."
        ]
      },
      "docs": {
        "readme": true,
        "docs_paths": [
          "README.md"
        ],
        "llms_context_paths": [],
        "notes": []
      },
      "related_capabilities": [],
      "notes": [
        "Pattern capability generated from deterministic file, route, dependency, or environment-name evidence."
      ]
    }
  ],
  "repository_risks": [
    {
      "id": "quality.missing-tests",
      "severity": "medium",
      "summary": "No automated test files were detected.",
      "evidence_paths": [
        "package.json",
        "README.md"
      ],
      "recommendation": "Add focused tests before treating capabilities as production-ready reuse candidates."
    }
  ],
  "catalog_quality": {
    "coverage": {
      "scan_artifact": true,
      "readme": true,
      "docs": true,
      "routes": false,
      "tests": false,
      "llms_context": false
    },
    "missing_evidence": [
      "test files not detected",
      "CI workflows not detected",
      "LLMs context files not detected",
      "framework route files not detected"
    ],
    "uncertainty_notes": [
      "Generated by evidence-bound bootstrap analyzer. Run with CATALOG_USE_CODEX=1 for schema-constrained Codex interpretation."
    ],
    "validation_status": "valid",
    "validated_at": "2026-05-16T16:44:27.386Z"
  }
}
